{
  "schema_version": "awesome-capture.chunk-set/v1",
  "job_id": "cccccccccccccccccccccccccccccccccccccccccccccccccccccccccccccccc",
  "source_sha256": "aaaaaaaaaaaaaaaaaaaaaaaaaaaaaaaaaaaaaaaaaaaaaaaaaaaaaaaaaaaaaaaa",
  "chunk_seconds": 600,
  "audio": {
    "sample_rate": 16000,
    "channels": 1,
    "sample_width": 2
  },
  "count": 1,
  "total_duration_ms": 1000,
  "chunks": [
    {
      "index": 0,
      "name": "chunk-00000.wav",
      "path": "/private/stage/chunk-00000.wav",
      "bytes": 32044,
      "sha256": "bbbbbbbbbbbbbbbbbbbbbbbbbbbbbbbbbbbbbbbbbbbbbbbbbbbbbbbbbbbbbbbb",
      "offset_ms": 0,
      "duration_ms": 1000,
      "sample_frames": 16000,
      "sample_rate": 16000
    }
  ]
}
